{
  "$schema": "../../../schemas/asset-request.schema.json", "schemaVersion": 1, "projectSlug": "tie-chu-mo-zhen", "assetId": "narration-scene-03-v2", "capability": "voice",
  "output": "public/projects/tie-chu-mo-zhen/audio/narration/03-creek-encounter.mp3",
  "text": "老婆婆坐在磨石旁，磨着粗重的铁杵。李白问：这么粗的铁杵，要磨成什么？她说：磨成一根针。",
  "voiceId": "ruyayichen", "model": "doubao-tts",
  "settings": {"provider": "doubao", "displayName": "儒雅逸辰", "speedRatio": 0.94, "pitch": -1, "performancePrompt": "温暖、沉静、不说教；叙述从容，李白问句带轻微好奇，老婆婆回答平静笃定，问答之间停顿清楚", "stage": "asset-production"}
}
