{
  "$schema": "../../../schemas/asset-request.schema.json", "schemaVersion": 1, "projectSlug": "tie-chu-mo-zhen", "assetId": "narration-scene-02-v2", "capability": "voice",
  "output": "public/projects/tie-chu-mo-zhen/audio/narration/02-mountain-road.mp3",
  "text": "山风吹乱竹叶，也吹乱了他的心。走到溪边，一阵沙沙的声音让他停下脚步。",
  "voiceId": "ruyayichen", "model": "doubao-tts",
  "settings": {"provider": "doubao", "displayName": "儒雅逸辰", "speedRatio": 0.94, "pitch": -1, "performancePrompt": "温暖、沉静、不说教；前半轻微游移，听到沙沙声后自然收住，留一点好奇和空间感", "stage": "asset-production"}
}
