{
  "$schema": "../../../schemas/asset-request.schema.json",
  "schemaVersion": 1,
  "projectSlug": "tie-chu-mo-zhen",
  "assetId": "narration-scene-3",
  "capability": "voice",
  "output": "public/projects/tie-chu-mo-zhen/audio/narration/scene-3.mp3",
  "text": "李白问：‘您磨铁杵做什么？’老婆婆回答：‘我要把它磨成针。’李白望着铁杵，又看看她始终不停的双手，明白了坚持的意义。",
  "voiceId": "ruyayichen",
  "model": "doubao-seed-tts-2.0",
  "settings": {"speedRatio": 0.94, "pitch": -1, "emotion": "happy", "emotionScale": 1, "performancePrompt": "温暖从容、清楚自然，像给五至九岁儿童讲古代故事；对白停顿清楚但不夸张角色表演，不说教"}
}
