{
  "$schema": "../../../schemas/asset-request.schema.json", "schemaVersion": 1, "projectSlug": "tie-chu-mo-zhen", "assetId": "narration-scene-06-v2", "capability": "voice",
  "output": "public/projects/tie-chu-mo-zhen/audio/narration/06-return-to-study.mp3",
  "text": "他重新背起书卷，回到山中。难懂的一页再读一遍，写不好的字再写一遍。铁杵磨亮的，是坚持的方向。",
  "voiceId": "ruyayichen", "model": "doubao-tts",
  "settings": {"provider": "doubao", "displayName": "儒雅逸辰", "speedRatio": 0.94, "pitch": -1, "performancePrompt": "温暖、沉静、不说教；回到山中要平实坚定，两个再一遍形成柔和重复，结句留有余韵而不是口号", "stage": "asset-production"}
}
