{
  "$schema": "../../../schemas/asset-request.schema.json",
  "schemaVersion": 1,
  "projectSlug": "tie-chu-mo-zhen",
  "assetId": "voice-audition-ruyayichen",
  "capability": "voice",
  "output": "public/projects/tie-chu-mo-zhen/audio/narration/audition-ruyayichen.mp3",
  "text": "相传，李白走到磨针溪边，看见一位老婆婆，正把粗粗的铁杵，一下一下磨在石头上。",
  "voiceId": "ruyayichen",
  "model": "doubao-seed-tts-2.0",
  "settings": {
    "speedRatio": 0.94,
    "pitch": -1,
    "emotion": "happy",
    "emotionScale": 1,
    "performancePrompt": "温暖从容、清楚自然，像给五至九岁儿童讲古代故事；保持好奇感，不说教，不夸张表演"
  }
}
