{
  "$schema": "../../../schemas/asset-request.schema.json",
  "schemaVersion": 1,
  "projectSlug": "tie-chu-mo-zhen",
  "assetId": "narration-scene-4",
  "capability": "voice",
  "output": "public/projects/tie-chu-mo-zhen/audio/narration/scene-4.mp3",
  "text": "于是，他回到山中，继续完成学业。《铁杵磨针》告诉我们：先确定正确的目标，再用合适的方法，一步一步坚持，困难也会慢慢变小。",
  "voiceId": "ruyayichen",
  "model": "doubao-seed-tts-2.0",
  "settings": {"speedRatio": 0.94, "pitch": -1, "emotion": "happy", "emotionScale": 1, "performancePrompt": "温暖从容、清楚自然，像给五至九岁儿童讲古代故事；结尾鼓励而不说教，不夸张表演"}
}
