{
  "$schema": "../../../schemas/asset-request.schema.json",
  "schemaVersion": 1,
  "projectSlug": "tie-chu-mo-zhen",
  "assetId": "voice-audition-ruyayichen-v2",
  "capability": "voice",
  "output": "public/projects/tie-chu-mo-zhen/audio/narration/audition-ruyayichen-v2.mp3",
  "text": "溪边，李白忍不住问：这么粗的铁杵，要磨成什么？老婆婆抬起头，平静地说：磨成一根针。",
  "voiceId": "ruyayichen",
  "model": "doubao-tts",
  "settings": {
    "provider": "doubao",
    "displayName": "儒雅逸辰",
    "speedRatio": 0.94,
    "pitch": -1,
    "performancePrompt": "温暖、沉静、不说教，像在溪边讲述古老寓言；问句带轻微好奇，回答平静笃定，停顿自然",
    "stage": "style-review"
  }
}
